Latitude,Longitude,Title,Description
51.4739657,-.235219,"Barn Elms Playing Fields (GB-ENG-London)","Common Kingfisher - <a href='http://ebird.org/ebird/view/checklist?subID=S19305071' target='_blank'>Checklist S19305071</a>"
50.679316,-3.4571837,"<a href='http://ebird.org/ebird/hotspot/L1072855' target='_blank'>Bowling Green--marsh</a> (GB-ENG-Devon)","Grey Heron, Little Egret, Spotted Redshank, Common Greenshank, Black-tailed Godwit, Dunlin, Little Gull, Ross's Gull, Common Swift, Eurasian Jackdaw, Carrion Crow, Barn Swallow, Blue Tit, Eurasian Wren - <a href='http://ebird.org/ebird/view/checklist?subID=S19305164' target='_blank'>Checklist S19305164</a>"
53.0587551,-1.6294098,"<a href='http://ebird.org/ebird/hotspot/L2236054' target='_blank'>Carsington Water</a> (GB-ENG-Derbyshire)","Canada Goose, Mallard, Great Northern Diver, Eurasian Coot, Northern Lapwing, Common Wood-Pigeon, Common Magpie, Marsh Tit, Great Tit, Blue Tit, Robin, Blackbird, Dunnock, Reed Bunting, Bullfinch, House Sparrow - <a href='http://ebird.org/ebird/view/checklist?subID=S20772645' target='_blank'>Checklist S20772645</a>"
53.2791271,-3.8040794,"<a href='http://ebird.org/ebird/hotspot/L1222559' target='_blank'>Conwy RSPB Reserve</a> (GB-WLS-Conwy)","Canada Goose, Mute Swan, Mallard, Eurasian/American Green-winged Teal, Great Crested Grebe, Grey Heron, Common Moorhen, Eurasian Coot, Eurasian Oystercatcher, Northern Lapwing, Common Sandpiper, Black-tailed Godwit, Common Snipe, Black-headed Gull, Herring Gull, Common Swift, Common Kingfisher, Common Magpie, Common House-Martin, Blue Tit, Blackcap, Blackbird, White/Pied Wagtail, Chaffinch, Goldfinch, House Sparrow - <a href='http://ebird.org/ebird/view/checklist?subID=S19305455' target='_blank'>Checklist S19305455</a>"
50.9309436,.9394598,"<a href='http://ebird.org/ebird/hotspot/L918439' target='_blank'>Dungeness RSPB Reserve</a> (GB-ENG-Kent)","Greylag Goose, Common Pochard, Tufted Duck, Great Cormorant, Little Egret, Eurasian Coot, Common Ringed Plover, Eurasian Collared-Dove, Rook, Carrion Crow, Chaffinch, Linnet - <a href='http://ebird.org/ebird/view/checklist?subID=S19331202' target='_blank'>Checklist S19331202</a>"
52.5460173,-3.9811363,"<a href='http://ebird.org/ebird/hotspot/L1290308' target='_blank'>Dyfi Estuary</a> (GB-WLS-Ceredigion)","Osprey, Common Buzzard, Eurasian Oystercatcher, Herring Gull, Eurasian Collared-Dove, Eurasian Jay, Rook, Great Tit, Blue Tit, Robin, Blackbird, Dunnock, Chaffinch, Greenfinch, Lesser Redpoll, Siskin - <a href='http://ebird.org/ebird/view/checklist?subID=S19305308' target='_blank'>Checklist S19305308</a>"
50.8338007,-1.0290456,"<a href='http://ebird.org/ebird/hotspot/L1190736' target='_blank'>Farlington Marshes LNR</a> (GB-ENG-Hampshire)","Brent Goose, Canada Goose, Mute Swan, Common Shelduck, Gadwall, Eurasian Wigeon, Mallard (Domestic type), Northern Shoveler, Northern Pintail, Eurasian/American Green-winged Teal, Red-breasted Merganser, Little Grebe, Great Crested Grebe, Little Egret, Common Buzzard, Common Moorhen, Eurasian Coot, Eurasian Oystercatcher, Grey Plover, Northern Lapwing, Eurasian Curlew, Ruddy Turnstone, Dunlin, Black-headed Gull, Herring Gull, Rock Dove, Feral Pigeon, Common Wood-Pigeon, Common Magpie, Carrion Crow, Great Tit, Blue Tit, Long-tailed Tit, Eurasian Wren, Robin, Stonechat, Blackbird, Starling, White/Pied Wagtail, Rock Pipit, Chaffinch, Goldfinch - <a href='http://ebird.org/ebird/view/checklist?subID=S19304651' target='_blank'>Checklist S19304651</a>"
51.4732574,-.3020382,"<a href='http://ebird.org/ebird/hotspot/L956644' target='_blank'>Kew Royal Botanical Gardens</a> (GB-ENG-London)","Common Kestrel - <a href='http://ebird.org/ebird/view/checklist?subID=S19304661' target='_blank'>Checklist S19304661</a>"
50.5259672,-3.5056257,"<a href='http://ebird.org/ebird/hotspot/L1210840' target='_blank'>Labrador Bay RSPB Reserve</a> (GB-ENG-Devon)","Peregrine Falcon, Cirl Bunting - <a href='http://ebird.org/ebird/view/checklist?subID=S19305515' target='_blank'>Checklist S19305515</a>"
54.515402,-3.1566811,"<a href='http://ebird.org/ebird/hotspot/L931952' target='_blank'>Lake District National Park</a> (GB-ENG-Cumbria)","Greylag Goose, Canada Goose, Mallard, Red-breasted Merganser, Grey Heron, Common Buzzard, Black-headed Gull, Lesser Black-backed Gull, Great Spotted Woodpecker, Common Magpie, Eurasian Jackdaw, Rook, Carrion Crow, Eurasian Wren, White-fronted Dipper, Robin, Wheatear, Blackbird, Starling, Dunnock, White/Pied Wagtail, Meadow Pipit, Yellowhammer, Chaffinch, Greenfinch, Goldfinch, House Sparrow, Tree Sparrow - <a href='http://ebird.org/ebird/view/checklist?subID=S19304900' target='_blank'>Checklist S19304900</a>"
52.190767,.1534545,"Langham Road (GB-ENG-Cambridgeshire)","Canada Goose, Mallard, Great Crested Grebe, Common Moorhen, Eurasian Coot, Black-headed Gull, Common Tern, Common Wood-Pigeon, Eurasian Collared-Dove, Common Kestrel, Common Magpie, Eurasian Jackdaw, Carrion Crow, Great Tit, Blue Tit, Eurasian Wren, White-fronted Dipper, Blackcap, Robin, Blackbird, Chaffinch, Greenfinch, House Sparrow - <a href='http://ebird.org/ebird/view/checklist?subID=S19330408' target='_blank'>Checklist S19330408</a>"
51.48959,-.21166,"London W14 9DZ, 31 Baron's Court Road (GB-ENG-London)","Feral Pigeon, Common Wood-Pigeon, Great Tit, Blue Tit, Robin, Blackbird - <a href='http://ebird.org/ebird/view/checklist?subID=S19935728' target='_blank'>Checklist S19935728</a>"
51.479496,-.232569,"<a href='http://ebird.org/ebird/hotspot/L939896' target='_blank'>London Wetland Centre WWT</a> (GB-ENG-London)","Barnacle Goose, Canada Goose, Mute Swan, Egyptian Goose, Common Shelduck, Gadwall, Eurasian Wigeon, Mallard, Northern Shoveler, Northern Pintail, Eurasian/American Green-winged Teal, Common Pochard, Tufted Duck, Little Grebe, Great Crested Grebe, Great Cormorant, Grey Heron, Common Moorhen, Eurasian Coot, Northern Lapwing, Common Redshank, Common Snipe, Black-headed Gull, Herring Gull, Lesser Black-backed Gull, Great Black-backed Gull, Feral Pigeon, Stock Dove, Common Wood-Pigeon, Great Spotted Woodpecker, Eurasian Green Woodpecker, Ring-necked Parakeet, Common Magpie, Carrion Crow, Coal Tit, Great Tit, Blue Tit, Long-tailed Tit, Eurasian Wren, Robin, Blackbird, Mistle Thrush, Starling, Dunnock, White/Pied Wagtail, Chaffinch - <a href='http://ebird.org/ebird/view/checklist?subID=S19304800' target='_blank'>Checklist S19304800</a> - <a href='http://ebird.org/ebird/view/checklist?subID=S19938930' target='_blank'>Checklist S19938930</a>"
52.7199356,-4.0250988,"<a href='http://ebird.org/ebird/hotspot/L1290310' target='_blank'>Mawddach Estuary</a> (GB-WLS-Gwynedd)","Little Egret, Common Redshank, Eurasian Curlew, Black-headed Gull, Great Tit, Blackbird - <a href='http://ebird.org/ebird/view/checklist?subID=S19305278' target='_blank'>Checklist S19305278</a>"
51.7611999,-1.2523556,"<a href='http://ebird.org/ebird/hotspot/L1066654' target='_blank'>Oxford University Parks</a> (GB-ENG-Oxfordshire)","Greylag Goose, Canada Goose, Mute Swan, Mallard, Tufted Duck, Common Pheasant, Red Kite, Common Moorhen, Eurasian Coot, Black-headed Gull, Feral Pigeon, Common Wood-Pigeon, Common Magpie, Eurasian Jackdaw, Carrion Crow, Robin, Blackbird, House Sparrow - <a href='http://ebird.org/ebird/view/checklist?subID=S19304829' target='_blank'>Checklist S19304829</a>"
52.5314697,-1.9507599,"<a href='http://ebird.org/ebird/hotspot/L1231446' target='_blank'>Sandwell Valley RSPB Reserve</a> (GB-ENG-West Midlands)","Canada Goose, Mute Swan, Mallard, Common Pochard, Great Crested Grebe, Great Cormorant, Grey Heron, Common Buzzard, Common Moorhen, Eurasian Coot, Northern Lapwing, Common Sandpiper, Black-headed Gull, Lesser Black-backed Gull, Feral Pigeon, Common Wood-Pigeon, Eurasian Green Woodpecker, Common Magpie, Carrion Crow, Great Tit, Blue Tit, Robin, Blackbird, Starling, White/Pied Wagtail, Goldfinch, House Sparrow - <a href='http://ebird.org/ebird/view/checklist?subID=S19305396' target='_blank'>Checklist S19305396</a>"
51.4483421,-.512522,"<a href='http://ebird.org/ebird/hotspot/L1756371' target='_blank'>Staines Moor</a> (GB-ENG-Surrey)","Canada Goose, Mute Swan, Common Pheasant, Great Cormorant, Grey Heron, Little Egret, Eurasian Sparrowhawk, Black-headed Gull, Feral Pigeon, Common Wood-Pigeon, Common Swift, Great Spotted Woodpecker, Ring-necked Parakeet, Common Magpie, Barn Swallow, Common House-Martin, Great Tit, Long-tailed Tit, Eurasian Wren, Cetti's Warbler, Common Chiffchaff, Blackcap, Garden Warbler, Lesser Whitethroat, Robin, Blackbird, Song Thrush, Starling, Dunnock, Grey Wagtail, Greenfinch, Goldfinch - <a href='http://ebird.org/ebird/view/checklist?subID=S19305121' target='_blank'>Checklist S19305121</a>"
52.6114393,-4.1272545,"<a href='http://ebird.org/ebird/hotspot/L1152259' target='_blank'>Tonfanau, Aber Dysynni estuary</a> (GB-WLS-Gwynedd)","Mute Swan, Common Shelduck, Mallard, Common Buzzard, Eurasian Oystercatcher, Common Ringed Plover, Common Sandpiper, Eurasian Curlew, Dunlin, Great Black-backed Gull, Carrion Crow, Common Raven, Skylark, Barn Swallow, Blue Tit, Eurasian Wren, Eurasian Reed-Warbler, Robin, Stonechat, Wheatear, Meadow Pipit, Chaffinch, Goldfinch, Linnet - <a href='http://ebird.org/ebird/view/checklist?subID=S19305250' target='_blank'>Checklist S19305250</a>"
50.8626793,-.5493593,"<a href='http://ebird.org/ebird/hotspot/L1232984' target='_blank'>WWT Arundel Wetland Centre</a> (GB-ENG-West Sussex)","Mute Swan, Common Shelduck, Mandarin Duck, Gadwall, Eurasian Wigeon, Mallard (Domestic type), Northern Shoveler, Eurasian/American Green-winged Teal, Common Pochard, Tufted Duck, Common Pheasant, Little Grebe, Great Cormorant, Common Buzzard, Common Moorhen, Eurasian Coot, Northern Lapwing, Common Snipe, Black-headed Gull, Common Wood-Pigeon, Common Kingfisher, Common Magpie, Eurasian Jackdaw, Carrion Crow, Great Tit, Blue Tit, Long-tailed Tit, Eurasian Wren, Common Chiffchaff, Robin, Blackbird, Song Thrush, Dunnock, Goldfinch, House Sparrow - <a href='http://ebird.org/ebird/view/checklist?subID=S19304617' target='_blank'>Checklist S19304617</a>"
51.1005038,1.3726044,"offshore of Dover (GB-ENG-Kent)","Northern Gannet - <a href='http://ebird.org/ebird/view/checklist?subID=S19305403' target='_blank'>Checklist S19305403</a>"
